Number,Id,Place,Price Range,Category,Types,Address,Postal Code,City,State,Country,Latitude,Longitude
1448,ChIJoTmPqwJgUocR_Z0I_Y0wD3Y,Dumke Field,,stadium,"stadium, point_of_interest, establishment","Salt Lake City, UT 84105, USA 84105",84105,Salt Lake City,Utah,United States,40.73108439999999,-111.8565102
1449,ChIJRy7f1TH1UocRyI_twVophas,Smith's Ballpark,,stadium,"stadium, point_of_interest, establishment","77 West 1300 S, Salt Lake City, UT 84115, USA 84115",84115,Salt Lake City,Utah,United States,40.7405609,-111.8926506
1450,ChIJAYlpsJRfUocRZ1KH2eA3Y2I,Ute Soccer and Lacrosse Field,,stadium,"stadium, point_of_interest, establishment","The University of Utah, 112 S Wasatch Dr, Salt Lake City, UT 84112, USA 84112",84112,Salt Lake City,Utah,United States,40.7668749,-111.8412733
1451,ChIJ11zoiJNfUocRrgDCkVJZ4yA,McCarthey Family Track and Field Complex,,stadium,"stadium, point_of_interest, establishment","S Wasatch Dr, Salt Lake City, UT 84112, USA 84112",84112,Salt Lake City,Utah,United States,40.7663939,-111.8392278
1452,ChIJjyD1vm71UocRw6kG7jaC6gY,Stadiumance,,stadium,"stadium, point_of_interest, establishment","18 N Rio Grande St, Salt Lake City, UT 84101, USA 84101",84101,Salt Lake City,Utah,United States,40.7678064,-111.9034363
1453,ChIJfbl-dvNfUocRl6ZIxxKv0Dg,Cauldron Legacy Plaza VC,,stadium,"stadium, point_of_interest, establishment","Salt Lake City, UT 84112, USA 84112",84112,Salt Lake City,Utah,United States,40.75880889999999,-111.8497321
1454,ChIJA57tsfBfUocR0wm-mWHelWs,East High School Football Stadium,,stadium,"stadium, point_of_interest, establishment","1427 E 800 S, Salt Lake City, UT 84105, USA 84105",84105,Salt Lake City,Utah,United States,40.7521222,-111.8504729
1455,ChIJafAZw_SLUocRVN1w5Eo17w0,Taylorsville Baseball Complex,,stadium,"stadium, point_of_interest, establishment","5059 S 2200 W, Taylorsville, UT 84129, USA 84129",84129,Taylorsville,Utah,United States,40.6609746,-111.947232
1456,ChIJL7U3QvNfUocR4JxgtiY95rI,C5,,stadium,"stadium, point_of_interest, establishment, subpremise","Salt Lake City, UT 84112, USA 84112",84112,Salt Lake City,Utah,United States,40.7601518,-111.8498602
1457,ChIJlb9qafNfUocRZM68AwbXBeg,C1,,stadium,"stadium, subpremise, point_of_interest, establishment","Salt Lake City, UT 84112, USA 84112",84112,Salt Lake City,Utah,United States,40.7598121,-111.8498602
1458,ChIJhSIUafNfUocRLkYOBptMD9I,Accessible Seating,,stadium,"stadium, subpremise, point_of_interest, establishment","Salt Lake City, UT 84112, USA 84112",84112,Salt Lake City,Utah,United States,40.759811,-111.8498893
1459,ChIJh-2G2JNfUocRCtK6YzxY7vk,Dumke Family Softball Stadium,,stadium,"stadium, premise, point_of_interest, establishment","102 S Wasatch Dr, Salt Lake City, UT 84112, USA 84112",84112,Salt Lake City,Utah,United States,40.7679712,-111.841022
1460,ChIJmSJQbyGKUocR1ugRNuiwDkE,Ken Price Field,,stadium,"stadium, premise, point_of_interest, establishment","Murray, UT 84107, USA 84107",84107,Murray,Utah,United States,40.6621371,-111.8848052
1461,ChIJ79hIQvNfUocRBsgBCUEjHeU,Accessible Seating,,stadium,"stadium, subpremise, point_of_interest, establishment","Salt Lake City, UT 84112, USA 84112",84112,Salt Lake City,Utah,United States,40.7601413,-111.8498893
1462,ChIJ3WcNQvNfUocR-8gsWvBrW80,C4,,stadium,"stadium, subpremise, point_of_interest, establishment","Salt Lake City, UT 84112, USA 84112",84112,Salt Lake City,Utah,United States,40.7600574,-111.8498602
1463,ChIJcbjpafNfUocRhidwJDpI7d8,C3,,stadium,"stadium, subpremise, point_of_interest, establishment","Salt Lake City, UT 84112, USA 84112",84112,Salt Lake City,Utah,United States,40.7599819,-111.8498602
1464,ChIJeUefafNfUocRk5zyHUEZcjY,C2,,stadium,"stadium, subpremise, point_of_interest, establishment","Salt Lake City, UT 84112, USA 84112",84112,Salt Lake City,Utah,United States,40.7598876,-111.8498602
1465,ChIJIZ4tCFMJK4cRF10FJZ3pXCE,Desert Botanical Garden,,museum,"tourist_attraction, park, museum, point_of_interest, establishment","1201 N Galvin Pkwy, Phoenix, AZ 85008, USA 85008",85008,Phoenix,Arizona,United States,33.4616795,-111.944926
1466,ChIJLRHTlB4SK4cR2b_LbUpRgfA,Arizona Science Center,,museum,"movie_theater, tourist_attraction, museum, point_of_interest, establishment","600 E Washington St, Phoenix, AZ 85004, USA 85004",85004,Phoenix,Arizona,United States,33.4485282,-112.0662095
1467,ChIJq1ARW0ISK4cRItccBOgJS9w,Heard Museum,,museum,"art_gallery, book_store, tourist_attraction, museum, point_of_interest, store, establishment","2301 N Central Ave, Phoenix, AZ 85004, USA 85004",85004,Phoenix,Arizona,United States,33.4725814,-112.0722331
1468,ChIJmcBGT0ASK4cR8QooSw1pSn4,Phoenix Art Museum,,museum,"tourist_attraction, museum, restaurant, food, point_of_interest, store, establishment","1625 N Central Ave, Phoenix, AZ 85004, USA 85004",85004,Phoenix,Arizona,United States,33.4670863,-112.0727721
1469,ChIJdUwOBBwSK4cR54UxlSuXRRM,Children’s Museum of Phoenix,,museum,"tourist_attraction, museum, point_of_interest, establishment","215 N 7th St, Phoenix, AZ 85034, USA 85034",85034,Phoenix,Arizona,United States,33.4504029,-112.0645824
1470,ChIJRa9tWD4LK4cRQx_YNIJsSqQ,McCormick-Stillman Railroad Park,,museum,"park, tourist_attraction, museum, point_of_interest, establishment","7301 E Indian Bend Rd, Scottsdale, AZ 85250, USA 85250",85250,Scottsdale,Arizona,United States,33.5370541,-111.9233062
1471,ChIJZaHOni0SK4cRroxWdOv1J3Q,Arizona Capitol Museum,,museum,"tourist_attraction, museum, point_of_interest, establishment","1700 W Washington St, Phoenix, AZ 85007, USA 85007",85007,Phoenix,Arizona,United States,33.4480967,-112.0970236
1472,ChIJWUdU3JMOK4cRt881Lq8QD1M,S'edav Va'aki Museum (formerly Pueblo Grande Museum),,museum,"tourist_attraction, museum, point_of_interest, establishment","4619 E Washington St, Phoenix, AZ 85034, USA 85034",85034,Phoenix,Arizona,United States,33.4457435,-111.9846914
1473,ChIJH3RDyxpyK4cR3AGKOVlZwQc,Buddy Stubbs Harley-Davidson,,museum,"museum, clothing_store, car_repair, store, point_of_interest, establishment","13850 N Cave Creek Rd, Phoenix, AZ 85022, USA 85022",85022,Phoenix,Arizona,United States,33.6124279,-112.0357852
1474,ChIJGcplxemnK4cRvhnQKCwAtXY,Arizona Museum of Natural History,,museum,"tourist_attraction, museum, point_of_interest, establishment","53 N Macdonald, Mesa, AZ 85201, USA 85201",85201,Mesa,Arizona,United States,33.4166023,-111.8336627
1475,ChIJk7P45KR0K4cRs_4gupl2URI,Cosanti Originals,,museum,"art_gallery, museum, point_of_interest, store, establishment","6433 E Doubletree Ranch Rd, Paradise Valley, AZ 85253, USA 85253",85253,Paradise Valley,Arizona,United States,33.5671674,-111.9423544
1476,ChIJ7zu16koJK4cRVP2jnPomddU,Hall of Flame Fire Museum,,museum,"tourist_attraction, museum, point_of_interest, establishment","6101 E Van Buren St, Phoenix, AZ 85008, USA 85008",85008,Phoenix,Arizona,United States,33.4476794,-111.953272
1477,ChIJay-ZzcALK4cREF0Y6Dzwiiw,Scottsdale Museum of Contemporary Art,,museum,"museum, point_of_interest, establishment","7374 E 2nd St, Scottsdale, AZ 85251, USA 85251",85251,Scottsdale,Arizona,United States,33.4915991,-111.9229328
1478,ChIJ-3zP6-ttK4cR512VMM-dsm4,North Mountain Visitor Center,,museum,"tourist_attraction, park, museum, travel_agency, book_store, point_of_interest, store, establishment","12950 N 7th St, Phoenix, AZ 85022, USA 85022",85022,Phoenix,Arizona,United States,33.5985498,-112.0668249
1479,ChIJJe0g35cLK4cRPaPgEjhcEXw,Fiesta Bowl Museum,,museum,"museum, point_of_interest, establishment","7135 E Camelback Rd #190, Scottsdale, AZ 85251, USA 85251",85251,Scottsdale,Arizona,United States,33.5005262,-111.9284806
1480,ChIJF50zRdoIK4cRWMY9O8bw-lc,ASU Art Museum,,museum,"art_gallery, tourist_attraction, museum, point_of_interest, establishment","51 E 10th St, Tempe, AZ 85281, USA 85281",85281,Tempe,Arizona,United States,33.4186906,-111.9390401
1481,ChIJo9pUJN2nK4cR6Acp00XqRR8,Mesa Arts Center,,museum,"tourist_attraction, museum, point_of_interest, establishment","1 E Main St, Mesa, AZ 85201, USA 85201",85201,Mesa,Arizona,United States,33.4139583,-111.83045
1482,ChIJg6HJFkcSK4cR-sO7cF-PAp8,Love and Hate Tattoo & Piercing,,museum,"art_gallery, museum, store, point_of_interest, establishment","322 W McDowell Rd, Phoenix, AZ 85003, USA 85003",85003,Phoenix,Arizona,United States,33.4659274,-112.0792156
1483,ChIJtytnAvhnK4cRmKktKrext-8,Earth & Space Expedition Center,,museum,"museum, tourist_attraction, point_of_interest, establishment","17835 N 44th St, Phoenix, AZ 85032, USA 85032",85032,Phoenix,Arizona,United States,33.6486878,-111.9853705
1484,ChIJh61MMz4SK4cRQbt1PJ1f05g,Arizona Jewish Historical Society,,museum,"museum, tourist_attraction, point_of_interest, establishment","122 E Culver St, Phoenix, AZ 85004, USA 85004",85004,Phoenix,Arizona,United States,33.4628862,-112.0717615
1485,ChIJwZ2FYr8RK4cRmwgyBi_AJDk,Nina Mason Pulliam Rio Salado Audubon Center,,museum,"park, museum, point_of_interest, establishment","3131 S Central Ave, Phoenix, AZ 85040, USA 85040",85040,Phoenix,Arizona,United States,33.41910849999999,-112.072164
1486,ChIJrwSD2mEMK4cR6O5xFSKCyWw,Shemer Art Center,,museum,"tourist_attraction, art_gallery, museum, point_of_interest, establishment","5005 E Camelback Rd, Phoenix, AZ 85018, USA 85018",85018,Phoenix,Arizona,United States,33.5050041,-111.9720636
1487,ChIJOQ8PBz0JK4cR7L7_sXCceis,Arizona Heritage Center,,museum,"tourist_attraction, museum, point_of_interest, establishment","1300 N College Ave, Tempe, AZ 85288, USA 85288",85288,Tempe,Arizona,United States,33.4431058,-111.9338978
1488,ChIJITZd9fQRK4cRx4gWC3_qIoU,George Washington Carver Museum and Cultural Center,,museum,"museum, point_of_interest, establishment","415 E Grant St, Phoenix, AZ 85004, USA 85004",85004,Phoenix,Arizona,United States,33.440527,-112.068191
1489,ChIJr5YLDOmnK4cRSkp-Jy4foZo,i.d.e.a. Museum,,museum,"tourist_attraction, art_gallery, museum, point_of_interest, establishment","150 W Pepper Pl, Mesa, AZ 85201, USA 85201",85201,Mesa,Arizona,United States,33.416723,-111.836178
1490,ChIJ3UCqTEhAK4cRWzBplaqXxLk,State Farm Stadium,,stadium,"stadium, point_of_interest, establishment","1 Cardinals Dr, Glendale, AZ 85305, USA 85305",85305,Glendale,Arizona,United States,33.5276247,-112.2625593
1491,ChIJhQ9idMEKK4cRnQTMJQmyr4Y,Salt River Fields at Talking Stick,,stadium,"stadium, point_of_interest, establishment","7555 N Pima Rd, Scottsdale, AZ 85258, USA 85258",85258,Scottsdale,Arizona,United States,33.5449922,-111.8861867
1492,ChIJX5ZIZd4IK4cRR_tnmenmfD4,Desert Financial Arena,,stadium,"stadium, point_of_interest, establishment","600 E Veterans Way, Tempe, AZ 85281, USA 85281",85281,Tempe,Arizona,United States,33.424495,-111.9310002
1493,ChIJkY5N-D4PK4cRQHj96Wfq-9A,Tempe Diablo Stadium,,stadium,"stadium, point_of_interest, establishment","2200 W Alameda Dr, Tempe, AZ 85282, USA 85282",85282,Tempe,Arizona,United States,33.40078149999999,-111.9709335
1494,ChIJTy7PkbQOK4cRCz472Lnz-2k,Phoenix Municipal Stadium,,stadium,"stadium, point_of_interest, establishment","5999 E Van Buren St #3410, Phoenix, AZ 85008, USA 85008",85008,Phoenix,Arizona,United States,33.4492164,-111.9547754
1495,ChIJcYVVpqOnK4cRnnZu2uc9vRg,Hohokam Stadium,,stadium,"stadium, point_of_interest, establishment","1235 N Center St, Mesa, AZ 85201, USA 85201",85201,Mesa,Arizona,United States,33.4385825,-111.8294729
1496,ChIJXwN8zPNAK4cRAUnOAd9kmDg,Camelback Ranch - Glendale,,stadium,"stadium, point_of_interest, establishment","10710 W Camelback Rd, Phoenix, AZ 85037, USA 85037",85037,Phoenix,Arizona,United States,33.51409939999999,-112.2958463
1497,ChIJ034zhcYLK4cRcKOE0My7Bog,Scottsdale Stadium,,stadium,"stadium, point_of_interest, establishment","7408 E Osborn Rd, Scottsdale, AZ 85251, USA 85251",85251,Scottsdale,Arizona,United States,33.4889347,-111.9207196
1498,ChIJscMorLQTK4cRQZtJ3VeEd8M,Arizona Veterans Memorial Coliseum,,stadium,"stadium, point_of_interest, establishment","1826 W McDowell Rd, Phoenix, AZ 85007, USA 85007",85007,Phoenix,Arizona,United States,33.469444,-112.096667
1499,ChIJ8V7j8_URK4cRXmKhO0s0OGY,Chase Field,,stadium,"stadium, point_of_interest, establishment","401 E Jefferson St, Phoenix, AZ 85004, USA 85004",85004,Phoenix,Arizona,United States,33.4453344,-112.0667091
1500,ChIJ3UCqTEhAK4cRvHQwBqmXnoY,Centerplate,,stadium,"stadium, point_of_interest, establishment","1 Cardinals Dr, Glendale, AZ 85305, USA 85305",85305,Glendale,Arizona,United States,33.5277234,-112.2628049
1501,ChIJLSpKwU8TK4cRZmiJiGhnQxM,Antelope Gymnasium,,stadium,"gym, stadium, health, point_of_interest, establishment","3300 W Camelback Rd Building 22, Phoenix, AZ 85017, USA 85017",85017,Phoenix,Arizona,United States,33.5123319,-112.132305
1502,ChIJe6aTZeEIK4cRaHQwYkDwef0,Alberta B. Farrington Softball Stadium,,stadium,"stadium, point_of_interest, establishment","510 S Athletes Pl, Tempe, AZ 85288, USA 85288",85288,Tempe,Arizona,United States,33.4252045,-111.9236184
1503,ChIJgcpYLMIUK4cRptVNrCUpiV8,American Family Fields of Phoenix,,stadium,"stadium, point_of_interest, establishment","3805 N 53rd Ave, Phoenix, AZ 85031, USA 85031",85031,Phoenix,Arizona,United States,33.492228,-112.1723735
1504,ChIJ80ZZVXgJK4cR9ZVyIBlP3dg,"Ticket Boat, Inc.",,stadium,"stadium, point_of_interest, store, establishment","8010 E McDowell Rd Ste 122, Scottsdale, AZ 85257, USA 85257",85257,Scottsdale,Arizona,United States,33.4663613,-111.90842
1505,ChIJPZcGiQYJK4cRUg28f8U-WnQ,Phoenix Rising FC Stadium,,stadium,"stadium, point_of_interest, establishment","3801 E Washington St, Phoenix, AZ 85034, USA 85034",85034,Phoenix,Arizona,United States,33.445208,-112.0014961
1506,ChIJxZmf5VETK4cRtBhcobNNg7U,GCU Stadium,,stadium,"stadium, point_of_interest, establishment","3300 W Camelback Rd, Phoenix, AZ 85017, USA 85017",85017,Phoenix,Arizona,United States,33.51210069999999,-112.1313258
1507,ChIJ_WN-KFITK4cRcNUHdkKwV5A,Brazell Field at GCU Ballpark,,stadium,"stadium, point_of_interest, establishment","5199 N 35th Ave #5159, Phoenix, AZ 85019, USA 85019",85019,Phoenix,Arizona,United States,33.5124741,-112.1334617
1508,ChIJ9wbRnD0EK4cR1zjuZsGMDxg,Ice Den Chandler,,stadium,"stadium, school, health, point_of_interest, store, establishment","7225 W Harrison St, Chandler, AZ 85226, USA 85226",85226,Chandler,Arizona,United States,33.31509969999999,-111.96734
1509,ChIJZ2EV8UkIK4cRfnIZnK8En0E,Sloan Park,,stadium,"stadium, point_of_interest, establishment","2330 W Rio Salado Pkwy, Mesa, AZ 85201, USA 85201",85201,Mesa,Arizona,United States,33.4311077,-111.881787
1510,ChIJNyeti5sHK4cRBGupQ234nYQ,Palo Verde Basketball Court,,stadium,"stadium, point_of_interest, establishment","3135 S Dobson Rd, Mesa, AZ 85202, USA 85202",85202,Mesa,Arizona,United States,33.358596,-111.8730211
1511,ChIJ0RwU--MIK4cRIiUjb2Qdiw0,Mountain America Stadium,,stadium,"stadium, point_of_interest, establishment","500 E Veterans Way, Tempe, AZ 85287, USA 85287",85287,Tempe,Arizona,United States,33.426453,-111.9325733
1512,ChIJkb8cVG8TK4cRcmS1FjdY2P8,GCU Softball Stadium,,stadium,"stadium, point_of_interest, establishment","15317005F, Phoenix, AZ 85017, USA 85017",85017,Phoenix,Arizona,United States,33.5142859,-112.1313303
1513,ChIJcUxSLsVsK4cR7YMxGjehLoM,Pagel Field at Ram Stadium,,stadium,"stadium, point_of_interest, establishment","N 23rd Ave, Phoenix, AZ 85015, USA 85015",85015,Phoenix,Arizona,United States,33.5354488,-112.107644
1514,ChIJQbOv1dpsK4cR813R4FEpuTg,Washington High School (Track And Field),,stadium,"stadium, point_of_interest, establishment","Phoenix, AZ 85015, USA 85015",85015,Phoenix,Arizona,United States,33.5360501,-112.1070275
1515,ChIJq81FLi4XsocRDzJ3TUXPU0A,Oklahoma City National Memorial & Museum,,museum,"museum, tourist_attraction, park, point_of_interest, establishment","620 N Harvey Ave, Oklahoma City, OK 73102, USA 73102",73102,Oklahoma City,Oklahoma,United States,35.4731496,-97.5170593
1516,ChIJQ-cenbQZsocRzRLrSk7iTUM,National Cowboy & Western Heritage Museum,,museum,"tourist_attraction, museum, point_of_interest, establishment","1700 NE 63rd St, Oklahoma City, OK 73111, USA 73111",73111,Oklahoma City,Oklahoma,United States,35.5356997,-97.4831286
1517,ChIJd9ZF_WgXsocRgImcelt0vX8,Oklahoma History Center,,museum,"tourist_attraction, library, museum, point_of_interest, establishment","800 Nazih Zuhdi Dr, Oklahoma City, OK 73105, USA 73105",73105,Oklahoma City,Oklahoma,United States,35.4940917,-97.4997465
1518,ChIJKa4uGEAXsocR_qyHWiHyzy0,Harn Homestead,,museum,"tourist_attraction, museum, point_of_interest, establishment","1721 N Lincoln Blvd, Oklahoma City, OK 73105, USA 73105",73105,Oklahoma City,Oklahoma,United States,35.4863587,-97.5037387
1519,ChIJ7Q9KmMoQsocRKuaBhdXckq0,Oklahoma Hall of Fame,,museum,"tourist_attraction, museum, point_of_interest, store, establishment","1400 Classen Dr, Oklahoma City, OK 73106, USA 73106",73106,Oklahoma City,Oklahoma,United States,35.4833808,-97.5261927
1520,ChIJMTLOFjEYsocRbB1wFzphEqI,Science Museum Oklahoma,,museum,"tourist_attraction, museum, point_of_interest, establishment","2020 Remington Pl, Oklahoma City, OK 73111, USA 73111",73111,Oklahoma City,Oklahoma,United States,35.5237553,-97.4754913
1521,ChIJ57ahxGMVsocRSSuU_1HuK34,Museum of Osteology,,museum,"museum, tourist_attraction, point_of_interest, establishment","10301 S Sunnylane Rd, Oklahoma City, OK 73160, USA 73160",73160,Oklahoma City,Oklahoma,United States,35.36483489999999,-97.4418414
1522,ChIJWZ4vC4cXsocRewMbzsIxhCU,45th Infantry Division Museum,,museum,"tourist_attraction, museum, point_of_interest, establishment","2145 NE 36th St, Oklahoma City, OK 73111, USA 73111",73111,Oklahoma City,Oklahoma,United States,35.5080499,-97.4737371
1523,ChIJm4qZBegZsocRBtkMLmTEvXo,Oklahoma Black Museum & Performing Arts Center,,museum,"museum, tourist_attraction, point_of_interest, establishment","4701 N Lincoln Blvd, Oklahoma City, OK 73105, USA 73105",73105,Oklahoma City,Oklahoma,United States,35.51873549999999,-97.5036102
1524,ChIJq2tUZzEYsocRA7TYlSseINA,Gymnastics Hall of Fame,,museum,"museum, gym, point_of_interest, health, establishment","2100 NE 52nd St, Oklahoma City, OK 73111, USA 73111",73111,Oklahoma City,Oklahoma,United States,35.5235768,-97.47541380000001
1525,ChIJz5z-FSwXsocR7irNXRDGniA,OKCMOA Museum Store,,museum,"museum, point_of_interest, store, establishment","415 Couch Dr, Oklahoma City, OK 73102, USA 73102",73102,Oklahoma City,Oklahoma,United States,35.4696783,-97.519893
1526,ChIJDSPUJbkQsocRSMVhgummyx4,Plaza Walls,,museum,"museum, point_of_interest, establishment","1745 NW 16th St Suite F4, Oklahoma City, OK 73106, USA 73106",73106,Oklahoma City,Oklahoma,United States,35.4863352,-97.5403371
1527,ChIJf3-cvT4YsocROnH6B9dsSqo,USA Softball Hall of Fame Museum and Gift Shop,,museum,"museum, point_of_interest, establishment","2801 NE 50th St, Oklahoma City, OK 73111, USA 73111",73111,Oklahoma City,Oklahoma,United States,35.5232514,-97.46318629999999
1528,ChIJuw3BHz0YsocRvrGDXWoMVZg,USA Softball Hall of Fame Complex,,museum,"museum, point_of_interest, establishment","2801 NE 50th St, Oklahoma City, OK 73111, USA 73111",73111,Oklahoma City,Oklahoma,United States,35.5243949,-97.46413419999999
1529,ChIJ5c3VjhkFsocRfJu4XYR1Z2Q,Oklahoma Museum of Flying,,museum,"museum, tourist_attraction, point_of_interest, establishment","7110 Millionaire Dr, Bethany, OK 73008, USA 73008",73008,Bethany,Oklahoma,United States,35.5337967,-97.6380221
1530,ChIJpabzWSYXsocRG40atnKXurw,American Banjo Museum,,museum,"museum, tourist_attraction, point_of_interest, establishment","9 E Sheridan Ave, Oklahoma City, OK 73104, USA 73104",73104,Oklahoma City,Oklahoma,United States,35.466806,-97.51149799999999
1531,ChIJZWrAP4kXsocREJNuVvDZd9Y,Oklahoma Railway Museum,,museum,"museum, tourist_attraction, point_of_interest, establishment","3400 NE Grand Blvd, Oklahoma City, OK 73111, USA 73111",73111,Oklahoma City,Oklahoma,United States,35.5051862,-97.46718969999999
1532,ChIJJctFYMEHsocRkzCFwpa74J0,Yukon Veterans Museum,,museum,"museum, point_of_interest, establishment","1010 W Main St, Yukon, OK 73099, USA 73099",73099,Yukon,Oklahoma,United States,35.5075755,-97.7594226
1533,ChIJo6tjr0gYsocRMtESmJE8sIw,The American Pigeon Museum & Library,,museum,"museum, tourist_attraction, point_of_interest, establishment","2300 NE 63rd St, Oklahoma City, OK 73111, USA 73111",73111,Oklahoma City,Oklahoma,United States,35.5363507,-97.47140379999999
1534,ChIJZ77F5WMVsocRVPWgUI51kPc,Skulls Unlimited International Inc.,,museum,"museum, store, point_of_interest, establishment","10313B S Sunnylane Rd, Oklahoma City, OK 73160, USA 73160",73160,Oklahoma City,Oklahoma,United States,35.3644268,-97.44189589999999
1535,ChIJ_dzVejoXsocRSvi0MVpDvIQ,Factory Obscura: Mix-Tape,,museum,"museum, point_of_interest, establishment","25 NW 9th St, Oklahoma City, OK 73102, USA 73102",73102,Oklahoma City,Oklahoma,United States,35.477265,-97.513356
1536,ChIJsx276TwYsocRjtRo9IvgaJk,Oklahoma Firefighters Museum,,museum,"museum, tourist_attraction, point_of_interest, establishment","2716 NE 50th St, Oklahoma City, OK 73111, USA 73111",73111,Oklahoma City,Oklahoma,United States,35.521718,-97.463852
1537,ChIJTcBe_GgXsocRJHkzGEVWpVg,Oklahoma Historical Society,,museum,"library, museum, point_of_interest, establishment","800 Nazih Zuhdi Dr, Oklahoma City, OK 73105, USA 73105",73105,Oklahoma City,Oklahoma,United States,35.4940607,-97.49972149999999
1538,ChIJBSL2IBsSsocRWZzCSzqRV2Y,The 99s Museum of Women Pilots,,museum,"museum, tourist_attraction, point_of_interest, establishment","4300 Amelia Earhart Ln, Oklahoma City, OK 73159, USA 73159",73159,Oklahoma City,Oklahoma,United States,35.40573980000001,-97.59753769999999
1539,ChIJHYJt3hoWsocR7D8Esv2yZhE,Ok Country Western Museum Hall,,museum,"museum, tourist_attraction, point_of_interest, establishment","3925 SE 29th St, Oklahoma City, OK 73115, USA 73115",73115,Oklahoma City,Oklahoma,United States,35.4359348,-97.446561
1540,ChIJmW2-HCgXsocRRZQdZbReN6U,Paycom Center,,stadium,"stadium, point_of_interest, establishment","100 W Reno Ave, Oklahoma City, OK 73102, USA 73102",73102,Oklahoma City,Oklahoma,United States,35.4634247,-97.5151138
1541,ChIJV6DhxiAXsocRQr2usO_YXPo,Chickasaw Bricktown Ballpark,,stadium,"stadium, point_of_interest, establishment","2 S Mickey Mantle Dr, Oklahoma City, OK 73104, USA 73104",73104,Oklahoma City,Oklahoma,United States,35.465199,-97.507761
1542,ChIJhdKbbbcfsocRwcWyeAhInIw,Chad Richison Stadium,,stadium,"stadium, point_of_interest, establishment","100 E University Dr, Edmond, OK 73034, USA 73034",73034,Edmond,Oklahoma,United States,35.6615051,-97.47076729999999
1543,ChIJ2fCJEqYXsocRHf05NMZcmLs,Moses F. Miller Stadium,,stadium,"stadium, point_of_interest, establishment","914 N Martin Luther King Ave, Oklahoma City, OK 73117, USA 73117",73117,Oklahoma City,Oklahoma,United States,35.4774731,-97.4760861
1544,ChIJCxqjFMw9socR8mZU0Kzsml0,Rose Field,,stadium,"stadium, point_of_interest, establishment","701 E Lockheed Dr, Midwest City, OK 73110, USA 73110",73110,Midwest City,Oklahoma,United States,35.4430473,-97.40052730000001
1545,ChIJFyihiaEFsocRifkGv_F6YM4,SNU Football Stadium,,stadium,"stadium, point_of_interest, establishment","Bethany, OK 73008, USA 73008",73008,Bethany,Oklahoma,United States,35.5210386,-97.66183199999999
1546,ChIJXYDDiu0csocRqfpFsDchiS8,Crossings Knights Stadium,,stadium,"stadium, point_of_interest, establishment","14400 Portland Ave, Oklahoma City, OK 73134, USA 73134",73134,Oklahoma City,Oklahoma,United States,35.6154961,-97.5790134
1547,ChIJwUt29cYLsocRAXyN2bGrFfE,Mustang Soccer Stadium,,stadium,"stadium, point_of_interest, establishment","331 W Forest Dr, Mustang, OK 73064, USA 73064",73064,Mustang,Oklahoma,United States,35.388171,-97.72801229999999
1548,ChIJR1OWhrUasocRtW_clBuM6p8,Pirate Stadium,,stadium,"stadium, point_of_interest, establishment","5300 NW 50th St, Oklahoma City, OK 73122, USA 73122",73122,Oklahoma City,Oklahoma,United States,35.5216132,-97.6066534
1549,ChIJrQ8-zNgSsocRBngQlckxHz8,Davis Ballpark,,stadium,"stadium, point_of_interest, establishment","12101 S May Ave, Oklahoma City, OK 73170, USA 73170",73170,Oklahoma City,Oklahoma,United States,35.3449411,-97.5699063
1550,ChIJx5UZcYcQsocRHa0NLplwO54,Energy FC Field at Taft Stadium,,stadium,"stadium, point_of_interest, establishment","2501 N May Ave, Oklahoma City, OK 73107, USA 73107",73107,Oklahoma City,Oklahoma,United States,35.4957713,-97.56643360000001
1551,ChIJha2se6QQsocR8Se0KWxyr1w,Stars Field,,stadium,"stadium, point_of_interest, establishment","2801-2899 N Florida Ave, Oklahoma City, OK 73106, USA 73106",73106,Oklahoma City,Oklahoma,United States,35.4975443,-97.5400464
1552,ChIJ9S_ecqcRsocREA8l58sYZlc,Jim Wade Stadium,,stadium,"stadium, point_of_interest, establishment","2601 N Kentucky Ave, Oklahoma City, OK 73106, USA 73106",73106,Oklahoma City,Oklahoma,United States,35.4965609,-97.54314930000001
1553,ChIJ00cf58kRsocRX7mkLLRcrvI,Ann Lacy Stadium,,stadium,"stadium, point_of_interest, establishment","1722 NW 28th St, Oklahoma City, OK 73106, USA 73106",73106,Oklahoma City,Oklahoma,United States,35.4980633,-97.54160859999999
1554,ChIJCYo7K60WsocR2KPoOuMgRNE,CB Speegle Stadium,,stadium,"stadium, point_of_interest, establishment","698 SW Grand Blvd #600, Oklahoma City, OK 73109, USA 73109",73109,Oklahoma City,Oklahoma,United States,35.427616,-97.52465310000001
1555,ChIJ-5f4OmIXsocRWjt-NIps-C8,Ruf-Nex Stadium,,stadium,"stadium, point_of_interest, establishment","2101 SE 22nd St, Oklahoma City, OK 73129, USA 73129",73129,Oklahoma City,Oklahoma,United States,35.44409479999999,-97.4747575
1556,ChIJN3dVqA4XsocRAAJP1bhJgwU,Eagle Stadium,,stadium,"stadium, point_of_interest, establishment","Del City, OK 73115, USA 73115",73115,Del City,Oklahoma,United States,35.4458315,-97.43856249999999
