Number,Id,Place,Price Range,Category,Types,Address,Postal Code,City,State,Country,Latitude,Longitude
1,ChIJ4Wp0qpY-mYAR35jT_LQ2Sa8,The Waterpark at Wild Island,,amusement_park,"tourist_attraction, park, amusement_park, point_of_interest, establishment","250 Wild Island Ct, Sparks, NV 89434, USA 89434",89434,Sparks,Nevada,United States,39.531658,-119.713385
2,ChIJx5Xtk0pHmYARbDTSo-fFHXc,Men's Club of Reno,2,night_club,"night_club, point_of_interest, establishment","270 Lake St, Reno, NV 89501, USA 89501",89501,Reno,Nevada,United States,39.5288239,-119.8109622
3,ChIJYS2UnlJHmYARLRc9YafcOHU,Spice House,,night_club,"night_club, point_of_interest, establishment","310 Spokane St, Reno, NV 89512, USA 89512",89512,Reno,Nevada,United States,39.5316307,-119.8004011
4,ChIJ9ZRHkUZwmYARugHVWsUpy-U,Lone Eagle Grille,3,night_club,"night_club, restaurant, bar, point_of_interest, food, establishment","111 Country Club Dr, Incline Village, NV 89451, USA 89451",89451,Incline Village,Nevada,United States,39.2379379,-119.9442881
5,ChIJIVde9FJHmYAR1NE9u7yxRKY,Fantasy Girls,,night_club,"night_club, point_of_interest, establishment","1095 E 4th St, Reno, NV 89512, USA 89512",89512,Reno,Nevada,United States,39.53307470000001,-119.79964
6,ChIJUxYrpsxAmYARnBDhw8_IklI,Hookava,,night_club,"night_club, bar, point_of_interest, establishment","100 N Arlington Ave, Reno, NV 89501, USA 89501",89501,Reno,Nevada,United States,39.52547020000001,-119.8168235
7,ChIJjaCunr5AmYARb-jRp5f36uA,The Z Bar,2,night_club,"bar, night_club, point_of_interest, establishment","1074 S Virginia St, Reno, NV 89502, USA 89502",89502,Reno,Nevada,United States,39.51374140000001,-119.8068709
8,ChIJ59Y408lAmYARxSgtCIpuhco,LCB Inc,,night_club,"night_club, point_of_interest, establishment","188 California Ave, Reno, NV 89509, USA 89509",89509,Reno,Nevada,United States,39.5199183,-119.8124281
9,ChIJKQNMdr1AmYARESWndUTUOqI,Lucke's Saloon,1,night_club,"night_club, restaurant, bar, point_of_interest, food, establishment","1455 S Wells Ave, Reno, NV 89502, USA 89502",89502,Reno,Nevada,United States,39.51131469999999,-119.8033599
10,ChIJx7WMEMpAmYARVRpCxiDd4js,RedRock Studio and Bar,1,night_club,"bar, night_club, point_of_interest, establishment","241 S Sierra St., Reno, NV 89501, USA 89501",89501,Reno,Nevada,United States,39.522599,-119.813131
11,ChIJ10In10pHmYARKmrneO89h_g,Greater Nevada Field,,stadium,"stadium, point_of_interest, establishment","250 Evans Ave, Reno, NV 89501, USA 89501",89501,Reno,Nevada,United States,39.5288493,-119.8077378
12,ChIJJxpYhRVHmYARh8D8O89ZqQM,Lawlor Events Center,,stadium,"stadium, point_of_interest, establishment","1664 N Virginia St, Reno, NV 89557, USA 89557",89557,Reno,Nevada,United States,39.54508,-119.8183072
13,ChIJzf7vKxRHmYARtx0Q9WhgIzc,Mackay Stadium,,stadium,"stadium, point_of_interest, establishment","1664 N Virginia St, Reno, NV 89557, USA 89557",89557,Reno,Nevada,United States,39.5469709,-119.8176081
14,ChIJHzNUwkRHmYARjvwnVT39LoE,Reno Rodeo Association,,stadium,"tourist_attraction, stadium, point_of_interest, establishment","Rodeo Arena, 1350 N Wls Ave, Reno, NV 89512, USA 89512",89512,Reno,Nevada,United States,39.5413662,-119.8008123
15,ChIJ25Oj0BRHmYARq16X8ctnKWk,William Peccole Park,,stadium,"stadium, point_of_interest, establishment","1775 Evans Ave, Reno, NV 89512, USA 89512",89512,Reno,Nevada,United States,39.54827309999999,-119.8127651
16,ChIJXeejIEtHmYARcp8A6NomHH4,Reno Aces Baseball,,stadium,"stadium, point_of_interest, establishment","250 Evans Ave, Reno, NV 89501, USA 89501",89501,Reno,Nevada,United States,39.5287552,-119.8091611
17,ChIJy2sGpWpHmYARH1Kxr5ONbts,Christina M. Hixson Softball Park,,stadium,"stadium, point_of_interest, establishment","100 Dolly Dr, Reno, NV 89512, USA 89512",89512,Reno,Nevada,United States,39.5459245,-119.8109773
18,ChIJZdKgmmVHmYARtmmI4qylJDE,Wolf Pack Park,,stadium,"stadium, point_of_interest, establishment","1664 N Virginia St, Reno, NV 89512, USA 89512",89512,Reno,Nevada,United States,39.5475394,-119.8150267
19,ChIJoR8TYzlJmYARQt8sEoKzPBQ,North Valleys Regional Park Baseball Fields,,stadium,"stadium, point_of_interest, establishment","Regional Park, 8085 Silver Lake Rd, Reno, NV 89506, USA 89506",89506,Reno,Nevada,United States,39.6226586,-119.8657389
20,ChIJp-uF6hVHmYARDiTzWTC1bjw,Robert Cashell Fieldhouse,,stadium,"stadium, premise, point_of_interest, establishment","Reno, NV 89557, USA 89557",89557,Reno,Nevada,United States,39.5456928,-119.8167597
21,ChIJSWBo0jVHmYARP9L6HN_1rCk,Aura Ultra Lounge,,night_club,"night_club, point_of_interest, establishment","407 N Virginia St, Reno, NV 89501, USA 89501",89501,Reno,Nevada,United States,39.5303945,-119.8145392
22,ChIJ5UzErTVHmYARXEIAz1iOXDU,NoVi,,night_club,"night_club, bar, point_of_interest, establishment","345 N Virginia St, Reno, NV 89501, USA 89501",89501,Reno,Nevada,United States,39.5287886,-119.8143539
23,ChIJKdvduMpAmYAR-Lhfs4hzQZc,The Rack,,night_club,"bar, bowling_alley, night_club, point_of_interest, establishment","111 N Virginia St, Reno, NV 89501, USA 89501",89501,Reno,Nevada,United States,39.525913,-119.8133118
24,ChIJ5wwxiUtHmYARu-jzB-DrL3Q,The Bird Reno,,night_club,"night_club, point_of_interest, establishment","555 E 4th St, Reno, NV 89512, USA 89512",89512,Reno,Nevada,United States,39.5316711,-119.8066243
25,ChIJeYmE9IVAmYARwrvb7BZ5crk,Fireside Lounge,,night_club,"night_club, bar, point_of_interest, establishment","2707 S Virginia St, Reno, NV 89502, USA 89502",89502,Reno,Nevada,United States,39.49722309999999,-119.8010219
26,ChIJqdXckBoVmYARIMwyAa7FH_0,Lounge - Reno,2,night_club,"bar, night_club, point_of_interest, establishment","770 S Meadows Pkwy #110, Reno, NV 89521, USA 89521",89521,Reno,Nevada,United States,39.437831,-119.7561138
27,ChIJ48E_cUZwmYARQsl954We_Jw,The Paddle Wheel Saloon,1,night_club,"night_club, bar, point_of_interest, establishment","120 Country Club Dr Suite 23L, Incline Village, NV 89451, USA 89451",89451,Incline Village,Nevada,United States,39.2401557,-119.9406639
28,ChIJb68xj44_mYAR1fn43Rq9T30,La Fonda Méxican Restaurant,2,night_club,"night_club, restaurant, point_of_interest, food, establishment","4385 Neil Rd #109, Reno, NV 89502, USA 89502",89502,Reno,Nevada,United States,39.484806,-119.7808401
29,ChIJb_2HK8tAmYAR4XVXXzHGB78,5 Star Saloon,1,night_club,"night_club, bar, point_of_interest, establishment","132 West St, Reno, NV 89505, USA 89505",89505,Reno,Nevada,United States,39.5258622,-119.8153998
30,ChIJQYr1tzRHmYARprafV5OUuT0,Tonic Lounge,1,night_club,"bar, night_club, point_of_interest, establishment","231 W 2nd St, Reno, NV 89501, USA 89501",89501,Reno,Nevada,United States,39.5263962,-119.8167218
31,ChIJWwckvBVHmYARaW55so2qMH4,Reno Orthopedic Sports Med. Complex,,stadium,"stadium, premise, point_of_interest, establishment","Reno, NV 89557, USA 89557",89557,Reno,Nevada,United States,39.5461921,-119.8159684
32,ChIJ88UvuBVHmYARdNR6qwqJ4tM,Stadium Visitors Locker Room,,stadium,"stadium, premise, point_of_interest, establishment","Reno, NV 89557, USA 89557",89557,Reno,Nevada,United States,39.5464473,-119.8163075
33,ChIJmerkthVHmYARzr1N7PfGQo4,Mackay Stadium South East Restroom,,stadium,"stadium, premise, point_of_interest, establishment","Reno, NV 89557, USA 89557",89557,Reno,Nevada,United States,39.5466699,-119.8161719
34,ChIJ8TZITRRHmYAR4JDZtpikHtA,Tennis Courts,,stadium,"stadium, premise, point_of_interest, establishment","Reno, NV 89557, USA 89557",89557,Reno,Nevada,United States,39.5472762,-119.8157875
35,ChIJgQRcHhRHmYARwdo8Mt5yarE,Mackay Stadium North West Restroom,,stadium,"stadium, premise, point_of_interest, establishment","Reno, NV 89557, USA 89557",89557,Reno,Nevada,United States,39.547399,-119.8184328
36,ChIJgUhpz9VAmYARSigBNXsIg0Q,Reno Huskies Football Field,,stadium,"stadium, premise, point_of_interest, establishment","Reno, NV 89509, USA 89509",89509,Reno,Nevada,United States,39.5171977,-119.8329697
37,ChIJRYQdLTRHmYARu8Op-jB28TE,Silver Legacy Resort Casino,,casino,"lodging, casino, point_of_interest, establishment","407 N Virginia St, Reno, NV 89501, USA 89501",89501,Reno,Nevada,United States,39.5304918,-119.8149946
38,ChIJBzXVmTNHmYAR6ipRaf8zVCE,J Resort,,casino,"casino, lodging, point_of_interest, establishment","345 N Arlington Ave, Reno, NV 89501, USA 89501",89501,Reno,Nevada,United States,39.5281442,-119.8188873
39,ChIJ07LkRY9AmYARbPPabWOgb1I,Peppermill Resort Spa Casino,,casino,"casino, spa, lodging, restaurant, point_of_interest, food, establishment","2707 S Virginia St, Reno, NV 89502, USA 89502",89502,Reno,Nevada,United States,39.4976865,-119.801139
40,ChIJxQpVnjo_mYARW9gkVzXSKgY,Nugget Casino Resort,,casino,"casino, lodging, point_of_interest, establishment","1100 Nugget Ave, Sparks, NV 89431, USA 89431",89431,Sparks,Nevada,United States,39.53334069999999,-119.7582759
41,ChIJkVAWfts-mYARIcOgGg3-Zpw,Western Village Inn & Casino,2,casino,"casino, lodging, restaurant, point_of_interest, food, establishment","815 Nichols Blvd, Sparks, NV 89434, USA 89434",89434,Sparks,Nevada,United States,39.5344449,-119.7338224
42,ChIJk5ehscpAmYARzEnEgofAsKs,Club Cal Neva,,casino,"casino, tourist_attraction, bar, parking, restaurant, food, point_of_interest, establishment","38 E 2nd St, Reno, NV 89501, USA 89501",89501,Reno,Nevada,United States,39.5267274,-119.8126797
43,ChIJY5VYasJ6mYARUEV8U5K2AAA,Crystal Bay Casino,,casino,"casino, tourist_attraction, point_of_interest, establishment","14 NV-28, Crystal Bay, NV 89402, USA 89402",89402,Crystal Bay,Nevada,United States,39.2275693,-120.0045958
44,ChIJgWiS__JSmYARD4xbeJ6PJYQ,Bordertown Casino and RV Resort,,casino,"rv_park, atm, tourist_attraction, convenience_store, casino, lodging, finance, restaurant, point_of_interest, store, food, establishment","19575 US-395, Reno, NV 89508, USA 89508",89508,Reno,Nevada,United States,39.6707083,-119.999934
45,ChIJz3-OZ9pBmYARgsnlyO0lLPU,Atlantis Casino Resort Spa,,casino,"casino, lodging, point_of_interest, establishment","3800 S Virginia St, Reno, NV 89502, USA 89502",89502,Reno,Nevada,United States,39.4889071,-119.7936863
46,ChIJqxKN930KmYARYL8T-Yg7-OA,Gold Dust West-Carson City,,casino,"casino, lodging, point_of_interest, establishment","2171 E William St, Carson City, NV 89701, USA 89701",89701,Carson City,Nevada,United States,39.1728498,-119.7436939
47,ChIJG7qnuls_mYARweP739kMgh8,Grand Sierra Resort and Casino,,casino,"night_club, casino, movie_theater, lodging, restaurant, bar, point_of_interest, food, establishment","2500 E 2nd St, Reno, NV 89595, USA 89595",89595,Reno,Nevada,United States,39.5230411,-119.7812235
48,ChIJ3Sp9O3lAmYARes4pCuUrdHg,Monarch Casino & Resort Inc,,casino,"casino, point_of_interest, establishment","3800 S Virginia St, Reno, NV 89502, USA 89502",89502,Reno,Nevada,United States,39.4889943,-119.7940163
49,ChIJ96vwRbBHmYARQBziT7xFPS4,Bonanza Casino,,casino,"casino, tourist_attraction, point_of_interest, establishment","4720 N Virginia St, Reno, NV 89506, USA 89506",89506,Reno,Nevada,United States,39.57114629999999,-119.8255411
50,ChIJV4qmAjqgmYARj1YqSkQDVe0,Casino Fandango,,casino,"casino, restaurant, point_of_interest, food, establishment","3800 S Carson St, Carson City, NV 89701, USA 89701",89701,Carson City,Nevada,United States,39.1316995,-119.771595
51,ChIJV_ZhrxAVmYAR3lxUugT-eIg,Sierra Gold,2,casino,"bar, casino, restaurant, food, point_of_interest, establishment","680 S Meadows Pkwy, Reno, NV 89521, USA 89521",89521,Reno,Nevada,United States,39.43811700000001,-119.759365
52,ChIJ82svbEc_mYARbo9psxsjoAE,Baldini's Sports Casino and Restaurant,,casino,"casino, tourist_attraction, bar, finance, restaurant, food, point_of_interest, establishment","865 S Rock Blvd, Sparks, NV 89431, USA 89431",89431,Sparks,Nevada,United States,39.526658,-119.767225
53,ChIJ9ZRHkUZwmYARFV5R4M0gyQ0,Grand Lodge Casino at Hyatt Regency Lake Tahoe,,casino,"casino, tourist_attraction, lodging, point_of_interest, establishment","111 Country Club Dr, Incline Village, NV 89451, USA 89451",89451,Incline Village,Nevada,United States,39.2401975,-119.9426097
54,ChIJ95Ii_E1HmYARV5UgUDlba2M,Diamond's Casino,,casino,"casino, tourist_attraction, point_of_interest, establishment","1010 E 6th St, Reno, NV 89512, USA 89512",89512,Reno,Nevada,United States,39.5340412,-119.7994381
55,ChIJNefIcEw_mYARCJh2qaHcAcY,Rail City Casino,,casino,"casino, bar, point_of_interest, establishment","2121 Victorian Ave, Sparks, NV 89431, USA 89431",89431,Sparks,Nevada,United States,39.5349313,-119.7721325
56,ChIJG2_a3BlbmYARAEhYpaDJ-tQ,Gold Ranch RV Resort,,casino,"rv_park, casino, campground, park, restaurant, lodging, point_of_interest, food, establishment","320 Gold Ranch Rd, Verdi, NV 89439, USA 89439",89439,Verdi,Nevada,United States,39.5018707,-120.001089
